;input_queries
0;select count ( * )  ,  t2.fullname  from model_list as t1 join car_makers as t2 on t1.maker   =   t2.id group by t2.id
1;select t2.id from model_list as t1 join car_makers as t2 on t1.maker   =   t2.id group by t2.id order by count ( * )  desc limit 1
2;select t1.model from model_list as t1 join car_makers as t2 on t1.maker   =   t2.id group by t1.model order by count ( * )
3;select count ( * )  ,  t2.fullname ,  t2.id from model_list as t1 join car_makers as t2 on t1.maker   =   t2.id group by t2.id having count ( * )   >=  3
4;select name from singer
5;select t2.name ,  count ( * )  from singer_in_concert as t1 join singer as t2 on t1.singer_id   =   t2.singer_id group by t2.singer_id
6;select count ( distinct template_id )  from documents
7;select count ( template_id )  from documents group by template_id having count ( * )   >  1
8;select template_id from documents group by template_id having count ( * )   >  1
9;select t1.first_name from students as t1 join addresses as t2 on t1.permanent_address_id   =   t2.address_id where t2.country   =   'haiti'
10;select first_name from students where cell_mobile_number  =  '09700166582'
11;select t1.last_name, * from students as t1 join addresses as t2 on t1.current_address_id  =  t2.address_id where t1.cell_mobile_number  =  '09700166582'
12;select email_address from students where cell_mobile_number  =  '09700166582'
13;select capacity from stadium where name  =  'balmoor'
14;select t2.theme from stadium as t1 join concert as t2 on t1.stadium_id  =  t2.stadium_id where t1.name  =  'balmoor'
15;select count ( * )  from dogs where dog_id in  (  select dog_id from treatments  )
16;select age from dogs where dog_id in  (  select dog_id from treatments  )
17;select count ( * )  from teacher
18;select count ( * )  from course_arrange
19;select t2.name , count ( * )  from course_arrange as t1 join teacher as t2 on t1.teacher_id  =  t2.teacher_id group by t2.name
20;select name , age from teacher
21;select latin_commander from battle where name  =  'battle of serres'
22;select result from battle where date  =  '31 january 1206'
23;select bulgarian_commander from battle where date  =  'june 1205'
24;select name from battle where latin_commander  =  'baldwin i'
25;select count ( * )  from tv_channel
26;select language from tv_channel where series_name = 'sky music'
27;select title from cartoon where id = 2.0
28;select horsepower from cars_data order by horsepower desc limit 1
29;select count ( * )  from cars_data
30;select sum ( cylinders )  from cars_data
31;select district from shop order by number_products desc limit 1
32;select manager_name from shop order by number_products desc limit 1
33;select number_products from shop order by number_products desc limit 1
34;select location from shop order by number_products desc limit 1
35;select shop_id from shop order by number_products desc limit 1
36;select avg ( population )  from city
37;select district from city where population  >   ( select avg ( population )  from city )
38;select count ( * )  ,  district from city where population  >   ( select avg ( population )  from city )  group by district
39;select name from country where governmentform   =   'us territory'
40;select gnp, population from country where governmentform   =   'us territory'
41;select avg ( gnp )  ,  sum ( population )  from country where governmentform   =   'us territory'
42;select sum ( surfacearea )  from country where continent  =  'asia'
43;select localname from country
44;select code from country where name  =  'aruba'
45;select count ( * )  from shop
46;select * from shop
47;select count ( * )  from hiring as t1 join shop as t2 on t1.shop_id   =   t2.shop_id group by t2.name
48;select name from singer
49;select song_release_year from singer where name  =  'joe sharp' and song_name  =  'you'
50;select count ( * )  from singer_in_concert as t1 join singer as t2 on t1.singer_id   =   t2.singer_id where t2.name  =  'joe sharp' group by t2.singer_id
51;select country from singer where name  =  'joe sharp'
52;select continent from continents
53;select t1.contid ,  t1.continent ,  count ( * )  from continents as t1 join countries as t2 on t1.contid   =   t2.continent group by t1.contid
54;select distinct t1.model from model_list as t1 join car_names as t2 on t1.model   =   t2.model join cars_data as t3 on t2.makeid   =   t3.id join car_makers as t4 on t1.maker   =   t4.id where t3.weight  <  3500
55;select distinct t3.weight from model_list as t1 join car_names as t2 on t1.model   =   t2.model join cars_data as t3 on t2.makeid   =   t3.id join car_makers as t4 on t1.maker   =   t4.id where t1.model = 'bmw'
56;select model from car_names where makeid = 2
57;select count ( * )  from country
58;select count ( distinct governmentform )  from country
59;select distinct governmentform from country
60;select count ( * )  from country where governmentform  =  'republic'
61;select name from country where governmentform  =  'republic'
62;select count ( * )  from airlines
63;select airline from airlines where airline = 'united airlines'
64;select abbreviation from airlines where airline = 'us airways'
65;select count ( * )  from singer
66;select citizenship from singer where name  =  'alice walton'
67;select sales from song where song_id  =  3
68;select country from airlines where airline  =  'delta airlines'
69;select destairport from flights where flightno  =  44
70;select t1.airline from airlines as t1 join flights as t2 on t1.uid   =   t2.airline group by t1.airline order by count ( * )  desc limit 1
71;select  count ( distinct course_id )  from courses
72;select  t1.course_name from courses as t1 join student_enrolment_courses as t2 on t1.course_id   =   t2.course_id group by t1.course_name order by count ( * )  limit 1
73;select  count ( * )  from concert
74;select t2.name , count ( * )  from concert as t1 join stadium as t2 on t1.stadium_id  =  t2.stadium_id group by t2.name
75;select capacity from stadium where name  =  'stark s park'
76;select concert_name from concert
77;select * from treatments order by cost_of_treatment desc limit 1
78;select cost_of_treatment from treatments order by date_of_treatment desc limit 1
79;select t1.airline from airlines as t1 join flights as t2 on t1.uid   =   t2.airline group by t1.airline having count ( * )   <  200
80;select t1.airline from airlines as t1 join flights as t2 on t1.uid   =   t2.airline group by t1.airline having count ( * )   <  200 limit 3
81;select nationality from people group by nationality having count ( * )   >  1
82;select people_id from people where nationality  =  'russia'
83;select people_id, name from people where nationality  =  'russia'
84;select avg ( loser_age )  from matches
85;select avg ( winner_age )  from matches
86;select avg ( minutes )  from matches
87;select max ( minutes )  from matches
88;select min ( minutes )  from matches
89;select count ( * )  from flights as t1 join airports as t2 on t1.destairport   =   t2.airportcode where t2.city  like  '%aberdeen%' or t2.city  like  '%abilene%'
90;select airportcode from  airports  where  city like '%abilene%'
91;select name from museum
92;select title from cartoon where directed_by  =  'ben jones' or directed_by  =  'brandon vietti'
93;select title, original_air_date from cartoon where directed_by  =  'ben jones' or directed_by  =  'brandon vietti'
94;select title, written_by from cartoon where directed_by  =  'ben jones' or directed_by  =  'brandon vietti'
95;select * from documents where document_description like '%w%'
96;select document_name from documents where document_description like '%w%'
97;select document_name , template_id from documents where document_description like '%w%'
98;select avg ( loser_age )   from matches
99;select avg ( winner_age )   from matches
100;select count ( * )  from matches where winner_hand  =  'l'
101;select winner_name, loser_name from matches where minutes  =   ( select max ( minutes )  from matches )
102;select name from dogs
103;select name from dogs where breed_code   =    (  select breed_code from dogs group by breed_code order by count ( * )  asc limit 1  )
104;select name, gender from dogs where breed_code   =    (  select breed_code from dogs group by breed_code order by count ( * )  asc limit 1  )
105;select t1.name ,  t2.date_of_treatment from dogs as t1 join treatments as t2 on t1.dog_id   =   t2.dog_id where t1.breed_code   =    (  select breed_code from dogs group by breed_code order by count ( * )  asc limit 1  )
106;select count ( * )  from student as t1 join has_pet as t2 on t1.stuid  =  t2.stuid join pets as t3 on t3.petid  =  t2.petid where t3.pettype  =  'cat'
107;select stuid from student except select t1.stuid from student as t1 join has_pet as t2 on t1.stuid   =   t2.stuid join pets as t3 on t3.petid   =   t2.petid where t3.pettype   =   'cat'
108;select t2.total_spent / t2.num_of_ticket from visitor as t1 join visit as t2 on t1.id   =   t2.visitor_id join museum as t3 on t3.museum_id   =   t2.museum_id where t3.name  =  'plaza museum'
109;select level_of_membership from visitor where name  =  'fernando gago'
110;select age from visitor where name  =  'fernando gago'
111;select t1.sourceairport from flights as t1 join airlines as t2 on t2.uid   =   t1.airline where t2.airline   =   'united airlines'
112;select t1.flightno from flights as t1 join airlines as t2 on t2.uid   =   t1.airline where t2.airline   =   'united airlines'
113;select destairport from flights where flightno  =  28
114;select destairport from flights where flightno  =  29
115;select first_name,  last_name from players
116;select first_name ,  last_name from players where hand   =   'l'
117;select count ( * )  from flights as t1 join airports as t2 on t1.destairport   =   t2.airportcode join airlines as t3 on t3.uid   =   t1.airline where t2.city   =   'aberdeen' and t3.airline   =   'united airlines'
118;select t3.name from course_arrange as t1 join course as t2 on t1.course_id   =   t2.course_id join teacher as t3 on t1.teacher_id   =   t3.teacher_id where t2.course   =   'math'
119;select t1.grade from course_arrange as t1 join course as t2 on t1.course_id   =   t2.course_id where t2.course  =  'math'
120;select t2.staring_date  from course_arrange as t1 join course as t2 on t1.course_id   =   t2.course_id where t2.course  =  'math'
121;select t1.birth_date from people as t1 join poker_player as t2 on t1.people_id   =   t2.people_id order by t2.earnings asc limit 1
122;select name from people as t1 join poker_player as t2 on t1.people_id   =   t2.people_id order by t2.earnings asc limit 1
123;select nationality from people as t1 join poker_player as t2 on t1.people_id   =   t2.people_id order by t2.earnings asc limit 1
124;select count ( * )  from poker_player
125;select count ( * )  from people as t1 join poker_player as t2 on t1.people_id   =   t2.people_id where t1.height  >  200
126;select avg ( t2.earnings )  from people as t1 join poker_player as t2 on t1.people_id   =   t2.people_id where t1.height  >  200
127;select t1.stuid from student as t1 join has_pet as t2 on t1.stuid  =  t2.stuid join pets as t3 on t3.petid  =  t2.petid where t3.pettype  =  'dog'
128;select t1.stuid from student as t1 join has_pet as t2 on t1.stuid  =  t2.stuid join pets as t3 on t3.petid  =  t2.petid where t3.pettype  =  'dog' intersect select t1.stuid from student as t1 join has_pet as t2 on t1.stuid  =  t2.stuid join pets as t3 on t3.petid  =  t2.petid where t3.pettype  =  'cat'
129;select t1.fname, t1.age from student as t1 join has_pet as t2 on t1.stuid  =  t2.stuid join pets as t3 on t3.petid  =  t2.petid where t3.pettype  =  'dog'
130;select count ( * )  from country
131;select countrycode  from city where name  =  'herat'
132;select population  from city where name  =  'qandahar'
133;select id from tv_channel where country in  ( select country from tv_channel group by country having count ( * )   >  2 )
134;select package_option from tv_channel where country in  ( select country from tv_channel group by country having count ( * )   >  2 )
135;select series_name from tv_channel order by series_name asc
136;select count ( * )  from dogs where dog_id in  (  select dog_id from treatments  )
137;select min ( age )  from dogs where dog_id in  (  select dog_id from treatments  )
138;select max ( age )  from dogs where dog_id in  (  select dog_id from treatments  )
139;select t2.weight from car_names as t1 join cars_data as t2 on t1.makeid   =   t2.id where t1.makeid  =  1
140;select t2.year from car_names as t1 join cars_data as t2 on t1.makeid   =   t2.id where t1.model  =  'buick'
141;select t2.horsepower from car_names as t1 join cars_data as t2 on t1.makeid   =   t2.id where t1.model  =  'plymouth'
142;select t1.model from car_names as t1 join cars_data as t2 on t1.makeid  =  t2.id where t2.cylinders  =  4 order by t2.horsepower desc limit 1
143;select count ( * )  from cars_data where year = '1974'
144;select id  from cars_data where year = '1974' and cylinders  =  '8'
145;select name from shop
146;select t1.shop_id from hiring as t1 join shop as t2 on t1.shop_id   =   t2.shop_id group by t1.shop_id
147;select t1.shop_id from hiring as t1 join shop as t2 on t1.shop_id   =   t2.shop_id group by t1.shop_id order by count ( * )  desc limit 1
148;select count ( distinct singer_id )  from singer
149;select count ( distinct t1.name )  from singer as t1 join song as t2 on t1.singer_id  =  t2.singer_id where t2.sales > 300000
150;select distinct t1.name from singer as t1 join song as t2 on t1.singer_id  =  t2.singer_id where t2.sales > 300000
151;select contestant_name from contestants
152;select count ( contestant_name )  from contestants
153;select contestant_name from contestants where contestant_number  =  1
154;select contestant_name from contestants where contestant_number  =  2
155;select airportname from airports
156;select count ( distinct flightno )  from flights
157;select count ( distinct country )  from airports
158;select count ( * )  from breeds
159;select t1.breed_name from breeds as t1 join dogs as t2 on t1.breed_code   =   t2.breed_code group by t1.breed_name order by count ( * )  desc limit 1
160;select t2.size_code from breeds as t1 join dogs as t2 on t1.breed_code   =   t2.breed_code where t1.breed_name = 'bulldog'
161;select t1.breed_name from breeds as t1 join dogs as t2 on t1.breed_code   =   t2.breed_code group by t1.breed_name order by count ( * )  desc limit 1
162;select name from conductor order by year_of_work desc limit 1
163;select year_of_work from conductor where name = 'robert craft'
164;select name from conductor order by year_of_work asc limit 1
165;select distinct nationality from people
166;select nationality from people
167;select count ( * )  from people where nationality  =  'russia'
168;select count ( * )  from people where nationality  =  'bulgaria'
169;select t1.id from car_makers as t1 join model_list as t2 on t1.id   =   t2.maker group by t1.id having count ( * )   >  3
170;select t1.fullname ,  t1.id from car_makers as t1 join model_list as t2 on t1.id   =   t2.maker group by t1.id having count ( * )   >  3
171;select id from cars_data order by horsepower desc limit 1
172;select accelerate from cars_data order by horsepower desc limit 1
173;select count ( * )  from cars_data where accelerate  >  19.0
174;select year from concert where concert_name  =  'auditions'
175;select year from concert where concert_name  =  'super bootcamp'
176;select year from concert where concert_name  =  'home visits'
177;select distinct tourney_name from matches
178;select tourney_name from matches group by tourney_name having count ( * )   >  10
179;select tourney_name from matches group by tourney_name having count ( * )   >  10
180;select count ( * )   from students
181;select distinct date_left from students
182;select first_name ,  middle_name ,  last_name from students order by date_left asc limit 1
183;select sourceairport from flights where flightno = '28'
184;select city from airports where airportcode = 'apg'
185;select airportname from airports where airportcode not in  ( select sourceairport from flights union select destairport from flights )
186;select * from transcripts order by transcript_date asc limit 1
187;select loser_rank_points from matches order by winner_age limit 3
188;select winner_age from matches order by winner_age limit 3
189;select count ( * )  from friend
190;select avg ( grade )  from highschooler
191;select distinct name  from highschooler
192;select count ( * )  from poker_player
193;select count ( * )  from people as t1 join poker_player as t2 on t1.people_id   =   t2.people_id where t2.earnings  >  300000
194;select t1.name from people as t1 join poker_player as t2 on t1.people_id   =   t2.people_id where t2.earnings  >  300000
195;select count ( * )  from museum
196;select num_of_staff from museum
197;select museum_id, name from museum order by num_of_staff desc limit 1
198;select count ( * )  from students
199;select first_name,middle_name,last_name  from students
200;select date_first_registered  from students
201;select count ( stuid )  from student
202;select age  from student where lname = 'smith'
203;select t2.petid ,age from student as t1 join has_pet as t2 on t1.stuid   =   t2.stuid where t1.lname   =   'smith'
204;select distinct t1.stuid from student as t1 join has_pet as t2 on t1.stuid   =   t2.stuid
205;select distinct t1.fname, t1.lname, t1.major, t1.age from student as t1 join has_pet as t2 on t1.stuid   =   t2.stuid
206;select fname, lname, major, age from student where stuid not in  ( select t1.stuid from student as t1 join has_pet as t2 on t1.stuid  =  t2.stuid join pets as t3 on t3.petid  =  t2.petid where t3.pettype  =  'cat' )
207;select count ( * )  from dogs
208;select age from dogs where name  =  'kacey'
209;select name from dogs order by weight desc limit 1
210;select size_code from dogs where breed_code  =  'bul'
211;select name from country order by population asc limit 3
212;select name from country order by surfacearea desc limit 1
213;select population from country where name  =  'antarctica'
214;select name, population from country order by population asc limit 3
215;select avg ( friend_id )  from friend
216;select avg ( grade )  from highschooler
217;select max ( grade )  from highschooler
218;select count ( * )  from students as t1 join student_enrolment as t2 on t1.student_id   =   t2.student_id join degree_programs as t3 on t2.degree_program_id   =   t3.degree_program_id where t3.degree_summary_name   =   'bachelor'
219;select t1.student_id from students as t1 join student_enrolment as t2 on t1.student_id   =   t2.student_id join degree_programs as t3 on t2.degree_program_id   =   t3.degree_program_id where t3.degree_summary_name   =   'bachelor'
220;select distinct t1.first_name, t1.middle_name, t1.last_name from students as t1 join student_enrolment as t2 on t1.student_id   =   t2.student_id join degree_programs as t3 on t2.degree_program_id   =   t3.degree_program_id where t1.student_id  =  9
221;select distinct t1.first_name, t1.middle_name, t1.last_name from students as t1 join student_enrolment as t2 on t1.student_id   =   t2.student_id join degree_programs as t3 on t2.degree_program_id   =   t3.degree_program_id where t1.student_id  =  7
222;select distinct t1.first_name ,  t1.middle_name ,  t1.last_name, t3.degree_summary_name from students as t1 join student_enrolment as t2 on t1.student_id   =   t2.student_id join degree_programs as t3 on t2.degree_program_id   =   t3.degree_program_id where t3.degree_summary_name   =   'bachelor'
223;select distinct t3.degree_summary_description from students as t1 join student_enrolment as t2 on t1.student_id   =   t2.student_id join degree_programs as t3 on t2.degree_program_id   =   t3.degree_program_id
224;select distinct t1.student_id from students as t1 join student_enrolment as t2 on t1.student_id   =   t2.student_id join degree_programs as t3 on t2.degree_program_id   =   t3.degree_program_id where t3.degree_summary_name   =   'bachelor'
225;select distinct t1.first_name ,  t1.middle_name ,  t1.last_name from students as t1 join student_enrolment as t2 on t1.student_id   =   t2.student_id join degree_programs as t3 on t2.degree_program_id   =   t3.degree_program_id where t3.degree_summary_name   =   'bachelor'
226;select count ( distinct make )  from car_names where model  =  'chevrolet'
227;select count ( distinct model )  from car_names
228;select model from car_names group by model order by count ( distinct make )  desc limit 1
229;select t2.name, t1.course_id from course_arrange as t1 join teacher as t2 on t1.teacher_id   =   t2.teacher_id
230;select t2.name ,  count ( * )  from course_arrange as t1 join teacher as t2 on t1.teacher_id   =   t2.teacher_id group by t2.name
231;select date from performance where type like '%audition%'
232;select count ( distinct orchestra_id )  from performance
233;select birth_date from players where player_id = 200002
234;select first_name from players where player_id = 200001
235;select country_code from players group by country_code having count ( * )  > 50
236;select region from country as t1 join city as t2 on t1.code   =   t2.countrycode where t2.name   =   'kabul'
237;select region from country as t1 join city as t2 on t1.code   =   t2.countrycode where t2.name   =   'herat'
238;select region from country as t1 join city as t2 on t1.code   =   t2.countrycode where t2.name   =   'qandahar'
239;select year from matches group by year order by count ( * )  desc limit 1
240;select year from matches group by year order by count ( * )  limit 1
241;select year, count ( * )  from matches group by year order by count ( * )  limit 1
242;select year, count ( * )  from matches where year  =  2016 group by year
243;select count ( * )  from matches where surface  =  'hard'
244;select t1.fullname , count ( * )  from car_makers as t1 join model_list as t2 on t1.id   =   t2.maker group by t1.id
245;select  id  from car_makers
246;select  country  from car_makers
247;select avg ( percentage )  from countrylanguage
248;select countrycode from countrylanguage where language  =  'dutch' order by percentage desc limit 1
249;select avg ( percentage )  from countrylanguage where language  =  'papiamento'
250;select level_of_membership from visitor where name  =   'gonzalo higuaΓ­n '
251;select name from visitor where level_of_membership =  5
252;select count ( * )  from visitor where level_of_membership>5
253;select age from visitor where level_of_membership   = 8
254;select count ( * )  from visitor where level_of_membership > 4
255;select name ,  level_of_membership from visitor where level_of_membership  >  4 order by age desc
256;select count ( distinct countrycode )  from countrylanguage where language  =  'chinese'
257;select name from country where continent  =  'north america'
258;select lifeexpectancy from country where name  =  'canada'
259;select count ( * )  from student as t1 join has_pet as t2 on t1.stuid   =   t2.stuid group by t1.stuid having count ( * )   >  1
260;select t1.lname, t1.fname  from student as t1 join has_pet as t2 on t1.stuid   =   t2.stuid group by t1.stuid having count ( * )   >  1
261;select t1.lname, t1.fname, t1.sex  from student as t1 join has_pet as t2 on t1.stuid   =   t2.stuid group by t1.stuid having count ( * )   >  1
262;select sum ( surfacearea )  from country where continent   =   'asia' or continent   =   'europe'
263;select count ( * )  from ref_template_types as t1 join templates as t2 on t1.template_type_code   =  t2.template_type_code where t1.template_type_description   =   'presentation'
264;select t2.template_id from ref_template_types as t1 join templates as t2 on t1.template_type_code   =  t2.template_type_code where t1.template_type_description   =   'presentation'
265;select t2.template_id, t2.template_type_code from ref_template_types as t1 join templates as t2 on t1.template_type_code   =  t2.template_type_code where t1.template_type_description   =   'presentation'
266;select count ( * )   from transcript_contents group by student_course_id order by count ( * )  desc limit 1
267;select student_course_id from transcript_contents group by student_course_id order by count ( * )  desc limit 1
268;select count ( * )  from transcript_contents group by student_course_id order by count ( * )  limit 1
269;select  student_course_id from transcript_contents group by student_course_id order by count ( * )  limit 1
270;select avg ( student_course_id )  from transcript_contents
271;select property_name from properties where room_count  >  1
272;select property_name from properties where property_type_code   =   'house' union select property_name from properties where property_type_code   =   'apartment' and room_count  >  1
273;select property_name, room_count from properties where property_type_code   =   'house' union select property_name, room_count from properties where property_type_code   =   'apartment' and room_count  >  1
274;select count ( * )  from properties where property_type_code   =   'apartment' and room_count   =   1
275;select avg ( agreed_selling_price )  from properties where property_type_code   =   'house' and room_count  >  1
276;select count ( * )  from airports
277;select count ( distinct sourceairport )  from flights
278;select count ( * )  from flights where destairport like '%asy%'
279;select count ( * )  from flights where destairport like '%asy%' and sourceairport like '%apg%' union select count ( * )  from flights where destairport like '%asy%' and sourceairport like '%abr%'
280;select flightno from flights where  ( sourceairport like '%apg%' or sourceairport like '%abr%' )  and destairport not like '%asy%'
281;select count ( * )  from car_makers as t1 join countries as t2 on t1.country   =   t2.country_id where t2.country_name   =   'germany'
