;input_queries
4117;select name, street_address from building where building_id in  ( select building_id from institution )
4118;select name from instructor
4119;select avg ( salary )  from instructor
4120;select name from instructor order by salary desc limit 1
4121;select firstname from reservations where code = 10105
4122;select lastname from reservations where code = 10105
4123;select count ( * )  from university
4124;select t1.school from university as t1 join basketball_match as t2 on t1.school_id   =   t2.school_id order by t2.acc_percent desc limit 1
4125;select t1.school from university as t1 join basketball_match as t2 on t1.school_id   =   t2.school_id order by t2.acc_percent limit 1
4126;select t1.primary_conference from university as t1 join basketball_match as t2 on t1.school_id   =   t2.school_id order by t2.acc_percent limit 1
4127;select t1.primary_conference, t1.founded from university as t1 join basketball_match as t2 on t1.school_id   =   t2.school_id order by t2.acc_percent limit 1
4128;select name from editor where age   =   24
4129;select name from editor where age   =   25
4130;select name, age from editor where age   =    ( select max ( age )  from editor )
4131;select name, age from editor where age   =    ( select min ( age )  from editor )
4132;select count ( * )  from editor where age>25 and age<45
4133;select name from editor where age>25 and age<45
4134;select count ( distinct payment_method_code )  from payments
4135;select payment_method_code from payments group by payment_method_code order by count ( * )  desc limit 1
4136;select payment_method_code from payments group by payment_method_code order by count ( * )  asc limit 1
4137;select payment_method_code, count ( * )  from payments group by payment_method_code having payment_method_code  =  'american express'
4138;select distinct payment_method_code from payments
4139;select dept_store_chain_name from  department_store_chain  where dept_store_chain_id  = 1
4140;select store_name from   department_stores
4141;select count ( * )  from department_stores as t1 join department_store_chain as t2 on t1.dept_store_chain_id  =  t2.dept_store_chain_id where t2.dept_store_chain_name  =  'south'
4142;select distinct payment_method_code from invoices
4143;select payment_method_code from invoices group by payment_method_code order by count ( * )  desc limit 1
4144;select count ( * )  from invoices where payment_method_code  =  'mastercard'
4145;select count ( * )  from sportsinfo as t1 join student as t2 on t1.stuid   =   t2.stuid where t1.sportname   =   'football'
4146;select t2.lname ,  t2.fname from sportsinfo as t1 join student as t2 on t1.stuid   =   t2.stuid where t1.sportname   =   'football'
4147;select count ( * )  from sportsinfo as t1 join student as t2 on t1.stuid   =   t2.stuid where t1.sportname   =   'lacrosse'
4148;select t2.lname ,  t2.fname from sportsinfo as t1 join student as t2 on t1.stuid   =   t2.stuid where t1.sportname   =   'lacrosse'
4149;select t2.stuid from sportsinfo as t1 join student as t2 on t1.stuid   =   t2.stuid where t1.sportname   =   'football' intersect select t2.stuid from sportsinfo as t1 join student as t2 on t1.stuid   =   t2.stuid where t1.sportname   =   'lacrosse'
4150;select t1.event_id ,  t1.service_id from events as t1 join participants_in_events as t2 on t1.event_id   =   t2.event_id group by t1.event_id having count ( * )   >  1
4151;select t1.event_details from events as t1 join participants_in_events as t2 on t1.event_id   =   t2.event_id group by t1.event_id having count ( * )   >  1
4152;select event_details, count ( * )  from events group by event_details
4153;select count ( * )  from airports
4154;select country from airports where city  =  'goroka'
4155;select count ( distinct headquarters )  from company
4156;select count ( * ) -1 from company where headquarters = 'usa'
4157;select headquarters from company group by headquarters order by count ( * )  desc limit 1
4158;select operating_system from web_client_accelerator where connection  =  'broadband, satellite, wireless, fiber, dsl'
4159;select market_share from browser where name  =  'safari'
4160;select t2.compatible_since_year from web_client_accelerator as t1 join accelerator_compatible_browser as t2 on t1.id  =  t2.accelerator_id where t1.name  =  'cproxy'
4161;select count ( * )  from browser
4162;select name  from browser
4163;select name from wine where year   =   2006
4164;select price from wine where year   =   2006
4165;select max ( price )  from wine where year   =   2006
4166;select name from wine where price>200
4167;select t1.name from accounts as t1 join checking as t2 on t1.custid   =   t2.custid join savings as t3 on t1.custid   =   t3.custid order by t2.balance + t3.balance limit 1
4168;select t1.name from accounts as t1 join checking as t2 on t1.custid   =   t2.custid join savings as t3 on t1.custid   =   t3.custid where t2.balance>3000
4169;select t1.name from accounts as t1 join checking as t2 on t1.custid   =   t2.custid join savings as t3 on t1.custid   =   t3.custid where t3.balance>20000
4170;select  balance from savings order  by  balance  desc  limit  1
4171;select  min ( balance )  from savings
4172;select  max ( balance ) ,min ( balance )  from checking
4173;select count ( * )  from visitors where tourist_id not in  (  select tourist_id from visits  )
4174;select tourist_details from visitors where tourist_id not in  (  select tourist_id from visits  )
4175;select t1.tourist_details from visitors as t1 join visits as t2 on t1.tourist_id  =  t2.tourist_id order by visit_date limit 1
4176;select t2.school ,  t3.name from school_bus as t1 join school as t2 on t1.school_id   =   t2.school_id join driver as t3 on t1.driver_id   =   t3.driver_id
4177;select t2.school ,  t3.name from school_bus as t1 join school as t2 on t1.school_id   =   t2.school_id join driver as t3 on t1.driver_id   =   t3.driver_id where t2.location  =  'honolulu, hawaii' or t2.location  =  'los angeles, california' or t2.location  =  'new york city' or t2.location  =  'cambridge, massachusetts'
4178;select count ( * )  from rating
4179;select stars from rating order by stars desc limit 1
4180;select stars from rating order by stars asc limit 1
4181;select donator_name ,  sum ( amount )  from endowment group by donator_name order by sum ( amount )  desc
4182;select donator_name ,  sum ( amount )  from endowment group by donator_name order by sum ( amount )  desc limit 1
4183;select donator_name ,  sum ( amount )  from endowment group by donator_name order by sum ( amount )  asc limit 1
4184;select count ( * )  from customers
4185;select age , sex from student where lname = 'smith' and fname  =  'linda'
4186;select gtype from video_games where gname = 'the vanishing of eric calder'
4187;select lname ,  sex from student where stuid in  ( select t1.stuid from plays_games as t1 join video_games as t2 on t1.gameid   =   t2.gameid where t2.gname   =   'call of destiny' intersect select t1.stuid from plays_games as t1 join video_games as t2 on t1.gameid   =   t2.gameid where t2.gname   =   'works of widenius' )
4188;select city_code from student where fname  = 'shiela' and lname  =  'jones'
4189;select job_title_code from staff_department_assignments where department_id = 4
4190;select date_assigned_from  from staff_department_assignments where staff_id = 1
4191;select distinct department_id  from staff_department_assignments where job_title_code = 'sales person'
4192;select date_assigned_to from staff_department_assignments where job_title_code = 'clerical staff'
4193;select date_assigned_from,date_assigned_to from staff_department_assignments where job_title_code  = 'sales person'
4194;select name , id from station
4195;select count ( * )   from station as t1 join route as t2 on t1.id   =   t2.station_id group by t2.station_id
4196;select roomname from rooms where baseprice  <  160 and beds  =   2 and decor   =   'modern'
4197;select roomname, roomid from rooms where baseprice  =   ( select max ( baseprice )  from rooms )
4198;select baseprice, roomname, roomid from rooms where baseprice  =   ( select min ( baseprice )  from rooms )
4199;select roomid, roomname, decor from rooms where beds  =   ( select max ( beds )  from rooms )
4200;select count ( * )  from products
4201;select min ( price )  from products
4202;select building_full_name from apartment_buildings where building_description  =  'studio'
4203;select building_manager from apartment_buildings where building_description  =  'studio'
4204;select building_full_name from apartment_buildings where building_full_name like '%court%'
4205;select count ( * )  from enzyme
4206;select count ( distinct enzyme_id )  from medicine_enzyme_interaction
4207;select count ( * )  from enzyme where id not in  (  select enzyme_id from medicine_enzyme_interaction  )
4208;select t1.product_id, t2.booked_amount from products_for_hire as t1 join products_booked as t2 on t1.product_id  =  t2.product_id
4209;select product_id from products_for_hire where product_id not in  (  select product_id from products_booked where booked_amount > 200  )
4210;select count ( * )  from products_for_hire where product_id not in  (  select product_id from products_booked where booked_amount > 200  )
4211;select count ( distinct gtype )  from video_games
4212;select gtype, count ( * )  from video_games group by gtype
4213;select gtype from video_games group by gtype order by count ( * )  limit 1
4214;select capacity, length, height, width from catalog_contents where catalog_entry_name  =  'cola'
4215;select price_in_dollars, price_in_euros, price_in_pounds from catalog_contents where catalog_entry_name  =  'cream soda'
4216;select catalog_entry_name from catalog_contents order by height desc limit 1
4217;select count ( * )  from professor where dept_code  =  'hist'
4218;select count ( * )  from professor where dept_code  =  'hist' and prof_high_degree  =  'ph.d.'
4219;select count ( distinct dept_code )  from professor
4220;select distinct dept_code from professor where dept_code  =  'eng'
4221;select count ( * )  from professor where dept_code  =  'eng' and prof_high_degree  =  'ph.d.'
4222;select prof_office from professor where dept_code  =  'hist' and prof_high_degree  =  'ph.d.'
4223;select count ( * )  from professor where prof_high_degree  =  'ph.d.'
4224;select count ( * )  from professor where prof_high_degree  =  'ph.d.' and dept_code  =  'acct'
4225;select prof_office from professor where prof_high_degree  =  'ph.d.' and dept_code  =  'acct'
4226;select prof_extension from professor where prof_high_degree  =  'ph.d.' and dept_code  =  'acct' and prof_office  =  'klr 229d'
4227;select name from captain order by age limit 1
4228;select age from captain order by age limit 1
4229;select name from captain order by age desc limit 1
4230;select count ( * )  from student where sex   =   'f' and city_code   =   'bal'
4231;select lname from student where sex   =   'f' and city_code   =   'bal'
4232;select lname from student where sex   =   'm' and age < 20
4233;select count ( * )  from acceptance
4234;select scores from submission order by scores desc limit 1
4235;select author from submission
4236;select college from submission where author = 'steve niehaus'
4237;select author from submission where submission_id not in  ( select submission_id from acceptance )
4238;select avg ( grade )  from list
4239;select avg ( ticket_price )   from exhibition where year  <  2009
4240;select min ( ticket_price )   from exhibition where year  <  2009
4241;select max ( ticket_price )   from exhibition where year  <  2009
4242;select avg ( ticket_price )   from exhibition where year   =  2005
4243;select avg ( ticket_price )   from exhibition where year  < 2006
4244;select count ( * )  from parties
4245;select count ( * )  from parties as t1 join party_forms as t2 on t1.party_id   =   t2.party_id where t2.form_id   =    ( select form_id from party_forms group by form_id order by count ( * )  desc limit 1 )
4246;select t1.party_email from parties as t1 join party_forms as t2 on t1.party_id   =   t2.party_id where t2.form_id   =    ( select form_id from party_forms group by form_id order by count ( * )  desc limit 1 )
4247;select count ( distinct department_id )  from staff_department_assignments
4248;select job_title_code from staff_department_assignments where department_id  =  5
4249;select count ( * )  from staff_department_assignments where job_title_code  =  'department manager'
4250;select born_state from head
4251;select born_state,age  from head order by age desc limit 1
4252;select born_state,age  from head where born_state  =  'texas'
4253;select count ( * )  from races
4254;select date from races  order by date  limit 1
4255;select date from races  order by date desc limit 1
4256;select name,date from races  order by date desc limit 1
4257;select count ( * )  from people as t1 join perpetrator as t2 on t1.people_id  =  t2.people_id where t2.country  =  'china'
4258;select rank ,  company ,  market_value from company where main_industry   =   'banking' order by sales_billion ,  profits_billion
4259;select company from company  order by market_value limit 1
4260;select market_value from company where company  =  'bp'
4261;select count ( * )  from problem_log
4262;select log_entry_date from problem_log order by log_entry_date asc limit 1
4263;select log_entry_date from problem_log order by log_entry_date desc limit 1
4264;select problem_log_id from problem_log order by log_entry_date desc limit 1
4265;select program_id, name from program
4266;select t1.name, t2.program_id from program as t1 join broadcast as t2 on t1.program_id  =  t2.program_id where t2.time_of_day  =  'morning'
4267;select friend from personfriend where name  =  'zach'
4268;select count ( * )  from personfriend where name  =  'alice' or name  =  'bob'
4269;select t2.emp_fname ,  t2.emp_lname from professor as t1 join employee as t2 on t1.emp_num   =   t2.emp_num order by t2.emp_fname
4270;select t1.prof_office from professor as t1 join employee as t2 on t1.emp_num   =   t2.emp_num order by t2.emp_fname
4271;select prof_high_degree from professor
4272;select zip_code from county where county_id  =  2
4273;select population from county where zip_code  =  'd21'
4274;select county_name from county where zip_code  =  'd02'
4275;select election_id from election where district  =  2
4276;select count ( distinct t2.delegate )  from county as t1 join election as t2 on t1.county_id   =   t2.district where t1.population  >  50000
4277;select * from university order by enrollment desc limit 3
4278;select * from university order by enrollment desc limit 1
4279;select primary_conference from university where school  =  'rutgers university'
4280;select t2.fname ,  t2.lname from has_allergy as t1 join student as t2 on t1.stuid  =  t2.stuid
4281;select count ( * )  from student where stuid not in  ( select t2.stuid from has_allergy as t1 join student as t2 on t1.stuid  =  t2.stuid )
4282;select lname, fname from student where stuid not in  ( select t2.stuid from has_allergy as t1 join student as t2 on t1.stuid  =  t2.stuid )
4283;select part_name from parts
4284;select part_id from parts
4285;select part_id ,  chargeable_amount from parts order by chargeable_amount asc limit 1
4286;select weight from people where name  =  'ty conklin'
4287;select height from people where name  =  'jack campbell'
4288;select sum ( domestic_passengers )  from airport
4289;select sum ( international_passengers )  from airport
4290;select airport_name from airport order by domestic_passengers desc limit 1
4291;select sum ( domestic_passengers )  from airport where airport_name like '%london%'
4292;select date_of_latest_revision from catalogs
4293;select date_of_latest_revision from catalogs group by date_of_latest_revision having count ( * )   >  1
4294;select catalog_name from catalogs where date_of_latest_revision in  ( select date_of_latest_revision from catalogs group by date_of_latest_revision having count ( * )  > 1 )
4295;select catalog_name, date_of_latest_revision from catalogs where date_of_latest_revision in  ( select date_of_latest_revision from catalogs group by date_of_latest_revision having count ( * )   >  1 )
4296;select date_of_latest_revision from catalogs group by date_of_latest_revision having count ( * )   >  1
4297;select distinct country from artist
4298;select color from grapes where grape  =  'barbera'
4299;select distinct grape from wine where score > 90
4300;select distinct t1.grape from grapes as t1 join wine as t2 on t1.grape   =   t2.grape where t1.color   =   'white'
4301;select distinct song_name from song where resolution  >   ( select min ( resolution )  from song where languages   =   'english' )
4302;select  country from song where resolution  >   ( select min ( resolution )  from song where languages   =   'english' )
4303;select  country,song_name, resolution from song where resolution  >   ( select min ( resolution )  from song where languages   =   'english' )
4304;select  song_name from song order by rating desc limit 3
4305;select  song_name,artist_name from song order by rating desc limit 3
4306;select count ( * )  ,  t1.name from accounts as t1 join checking as t2 on t1.custid   =   t2.custid group by t1.name
4307;select  max ( balance )   from  checking
4308;select  min ( balance )   from  checking
4309;select * from checking
4310;select * from savings
4311;select * from accounts
4312;select t3.balance from accounts as t1 join checking as t2 on t1.custid   =   t2.custid join savings as t3 on t1.custid   =   t3.custid order by t2.balance desc limit 1
4313;select category from music_festival
4314;select category from music_festival group by category having count ( * )   =  1
4315;select category from music_festival group by category having count ( * )  > 1
4316;select t2.name from gymnast as t1 join people as t2 on t1.gymnast_id   =   t2.people_id order by t1.total_points desc
4317;select height from  people where name = 'paul hamm'
4318;select sum ( total_points )  from gymnast as t1 join people as t2 on t1.gymnast_id   =   t2.people_id where t2.name = 'paul hamm'
4319;select rings_points from gymnast as t1 join people as t2 on t1.gymnast_id   =   t2.people_id where t2.name = 'paul hamm'
4320;select type from institution group by type order by count ( * )  desc limit 1
4321;select type from institution group by type order by count ( * )  asc limit 1
4322;select type from institution group by type order by count ( * )  desc limit 1
4323;select count ( * )  from customers
4324;select customer_name from customers
4325;select other_details from customers
4326;select product_name from products
4327;select max ( product_price )  from products
4328;select product_price from products where product_name = 'dvds'
4329;select dept_name from instructor where name like '%soisalon%'
4330;select id from instructor where dept_name  =  'psychology'
4331;select count ( * )  from ship
4332;select count ( distinct crs_code )  from course
4333;select count ( dept_code )  from department
4334;select crs_code from course where crs_description = 'statistics'
4335;select crs_description from course
4336;select crs_code from course where crs_description = 'intro. to statistics'
4337;select t2.dept_name from course as t1 join department as t2 on t1.dept_code   =   t2.dept_code where t1.crs_description  = 'intro. to statistics'
4338;select count ( * )  from student
4339;select t2.name from department as t1 join instructor as t2 on t1.dept_name   =   t2.dept_name where t1.dept_name = 'astronomy'
4340;select t2.name,t2.salary from department as t1 join instructor as t2 on t1.dept_name   =   t2.dept_name where t1.dept_name = 'astronomy'
4341;select name from cinema
4342;select name from cinema order by openning_year asc limit 1
4343;select avg ( capacity )  from cinema
4344;select location from cinema except select location from cinema where capacity  >  800
4345;select name from branch order by membership_amount asc limit 1
4346;select open_year from branch where branch_id = 3
4347;select open_year from branch group by open_year having count ( * )    >=    2
4348;select t1.city from city as t1 join temperature as t2 on t1.city_id   =   t2.city_id order by mar  limit  1
4349;select t1.city from city as t1 join temperature as t2 on t1.city_id  =  t2.city_id where t2.mar < t2.jul
4350;select t1.city from city as t1 join temperature as t2 on t1.city_id  =  t2.city_id where  t2.mar > t2.oct
4351;select complaint_status_code , count ( * )  from complaints where complaint_type_code   =   'product failure' group by complaint_status_code
4352;select complaint_outcome_code from complaints where complaint_type_code   =   'product failure'
4353;select complaint_status_code  from complaints where complaint_type_code   =   'product failure'
4354;select count ( * )  from investors
4355;select t2.investor_id from investors as t1 join transactions as t2 on t1.investor_id   =   t2.investor_id group by t2.investor_id having count ( * )    >=    2
4356;select marketing_region_name from marketing_regions
4357;select marketing_region_code from stores where store_name  =  'rob dinning'
4358;select t1.marketing_region_name from marketing_regions as t1 join stores as t2 on t1.marketing_region_code  =  t2.marketing_region_code where t2.store_name  =  'rob dinning'
4359;select * from stores where store_name  =  'rob dinning'
4360;select t1.marketing_region_name from marketing_regions as t1 join stores as t2 on t1.marketing_region_code  =  t2.marketing_region_code where t2.store_name  =  'rob dinning'
4361;select t1.name from editor as t1 join journal_committee as t2 on t1.editor_id   =   t2.editor_id group by t1.name having count ( * )    >=    2
4362;select t2.work_type from editor as t1 join journal_committee as t2 on t1.editor_id   =   t2.editor_id where t1.name  =  'kamila porczyk'
4363;select t1.age from editor as t1 where t1.name  =  'anna powierza'
4364;select t2.work_type from editor as t1 join journal_committee as t2 on t1.editor_id   =   t2.editor_id where t1.name  =  'anna powierza'
4365;select catalog_publisher from catalogs group by catalog_publisher order by catalog_publisher desc
4366;select catalog_publisher, count ( * )  from catalogs group by catalog_publisher
4367;select catalog_publisher from catalogs group by catalog_publisher order by count ( * )  desc limit 1
4368;select t1.amenid from dorm_amenity as t1 where t1.amenity_name  =  'tv lounge'
4369;select  t1.fname from faculty as t1 join faculty_participates_in as t2 on t1.facid   =   t2.facid group by t1.facid order by count ( * )  desc limit 1
4370;select  t1.lname from faculty as t1 join faculty_participates_in as t2 on t1.facid   =   t2.facid group by t1.facid order by count ( * )  desc limit 1
4371;select  rank from faculty where fname  =  'mark'
4372;select enroll_grade from enroll where stu_num = 324257
4373;select count ( * )  from class
4374;select count ( * )  from student
4375;select count ( * )  from club as t1 join member_of_club as t2 on t1.clubid  =  t2.clubid where t1.clubname  =  'bootup baltimore'
4376;select t3.age from club as t1 join member_of_club as t2 on t1.clubid  =  t2.clubid join student as t3 on t2.stuid  =  t3.stuid where t1.clubname  =  'bootup baltimore'
4377;select avg ( t3.age )  from club as t1 join member_of_club as t2 on t1.clubid  =  t2.clubid join student as t3 on t2.stuid  =  t3.stuid where t1.clubname  =  'bootup baltimore'
4378;select t3.fname, t3.lname from club as t1 join member_of_club as t2 on t1.clubid  =  t2.clubid join student as t3 on t2.stuid  =  t3.stuid where t1.clubname  =  'bootup baltimore' and t2.position  =  'president'
4379;select clublocation from club where clubname  =  'bootup baltimore'
4380;select t2.name from grapes as t1 join wine as t2 on t1.grape   =   t2.grape where t1.color   =   'red'
4381;select t2.name from grapes as t1 join wine as t2 on t1.grape   =   t2.grape where t1.color   =   'red' and t2.price  >  50
4382;select t2.state from grapes as t1 join wine as t2 on t1.grape   =   t2.grape where t1.color   =   'red' and t2.price  >  50
4383;select count ( * )  from employees
4384;select salary from employees where employee_id  =  101
4385;select phone_number from employees where employee_id  =  102
4386;select capacity from cinema where name  =  'codling'
4387;select max ( capacity )  from cinema
4388;select location from cinema where name  =  'codling'
4389;select city_code from student
4390;select city_code from student group by city_code order by count ( * )  desc limit 1
4391;select t1.role_description from roles as t1 join employees as t2 on t1.role_code  =  t2.role_code where t2.employee_name  =  'koby'
4392;select t1.role_code from roles as t1 join employees as t2 on t1.role_code  =  t2.role_code where t2.employee_name  =  'koby'
4393;select lname, age, fname from student where stuid  =  1003 or stuid  =  1004
4394;select sex, city_code from student where stuid  =  1005 or stuid  =  1004
4395;select sex, count ( * )  from student group by sex
4396;select lname from student where sex   =   'f' order by age desc
4397;select major from student group by major order by count ( * )  desc limit 1
4398;select avg ( age )  from student where major  =   ( select major from student group by major order by count ( * )  desc limit 1 )
4399;select sex from student where major  =   ( select major from student group by major order by count ( * )  desc limit 1 )
4400;select count ( * )  from architect as t1 join bridge as t2 on t1.id  =  t2.architect_id  where t1.name  =  'frank lloyd wright'
4401;select count ( * )  from architect as t1 join bridge as t2 on t1.id  =  t2.architect_id  where t1.name  =  'frank gehry'
4402;select t1.name from architect as t1 join bridge as t2 on t1.id  =  t2.architect_id  where t2.name  =  'xian ren qiao  ( fairy bridge ) '
4403;select name from architect where id  =  2
4404;select company_name from third_party_companies
