;input_queries
2784;select  other_details from  maintenance_engineers
2785;select last_name from maintenance_engineers
2786;select count ( * )  from representative where party  =  'republican'
2787;select count ( * )  from representative where party  =  'democratic'
2788;select major ,  count ( * )  from student group by major having count ( major )  between 2 and 30
2789;select major ,  fname from student where major  =   ( select major from student group by major order by count ( * )  desc limit 1 )
2790;select major ,  fname from student where major  =   ( select major from student group by major order by count ( * )  asc limit 1 )
2791;select count ( t2.song_name )  from files as t1 join song as t2 on t1.f_id   =   t2.f_id where t2.resolution  <  800
2792;select t1.file_size from files as t1 join song as t2 on t1.f_id   =   t2.f_id where t2.resolution  <  800
2793;select t1.formats from files as t1 join song as t2 on t1.f_id   =   t2.f_id where t2.resolution  <  800
2794;select district_name from district where city_population  =   ( select max ( city_population )  from district )
2795;select city_population, city_area from district where city_population  =   ( select max ( city_population )  from district )
2796;select dept_name from department
2797;select count ( * )  from apartments
2798;select count ( * )  from apartment_bookings as t1 join apartments as t2 on t1.apt_id   =   t2.apt_id where t2.bedroom_count  >  2
2799;select t1.booking_start_date ,  t1.booking_start_date from apartment_bookings as t1 join apartments as t2 on t1.apt_id   =   t2.apt_id where t2.bedroom_count  >  2
2800;select count ( * )  from student_course_enrolment as t1 join students as t2 on t1.student_id   =   t2.student_id group by t1.student_id order by count ( * )  desc limit 1
2801;select student_id from student_course_enrolment where registration_id  =  19
2802;select booking_made_date from services as t1 join party_services as t2 on t1.service_id   =   t2.service_id where t1.service_id   =  '1'
2803;select count ( * )  from customers
2804;select customer_id, count ( * )  from orders group by customer_id
2805;select name from reviewer
2806;select count ( t2.rid )  from rating as t1 join reviewer as t2 on t1.rid   =   t2.rid where t1.stars  >  3
2807;select t2.name from rating as t1 join reviewer as t2 on t1.rid   =   t2.rid where t1.stars  >  3
2808;select donator_name from endowment where amount > 8.5
2809;select max ( booked_amount )  from products_booked
2810;select min ( booked_count )  from products_booked
2811;select max ( booked_count )  from products_booked
2812;select min ( booked_amount )  from products_booked
2813;select t2.name from gymnast as t1 join people as t2 on t1.gymnast_id  =  t2.people_id order by t2.height desc limit 1
2814;select height from people where name = 'nadia caba rodrΓ­guez'
2815;select t2.name from gymnast as t1 join people as t2 on t1.gymnast_id  =  t2.people_id order by t2.height
2816;select classroom from list group by classroom order by count ( * )  desc limit 1
2817;select firstname from list where firstname like ' s%' and classroom in  ( select classroom from list group by classroom order by count ( * )  desc limit 1 )
2818;select customer_id from customers where customer_name  = 'america jaskolski'
2819;select count ( * )  from customers as t1
2820;select date_opened from customers_policies where customer_id  =  214
2821;select name from tourist_attractions
2822;select name from tourist_attractions where how_to_get_there  =  'bus'
2823;select t2.name from locations as t1 join tourist_attractions as t2 on t1.location_id  =  t2.location_id where t1.address  =  '254 ottilie junction'
2824;select t1.location_name from locations as t1 join tourist_attractions as t2 on t1.location_id  =  t2.location_id where t2.how_to_get_there  =  'bus'
2825;select t1.address from locations as t1 join tourist_attractions as t2 on t1.location_id  =  t2.location_id where t2.how_to_get_there  =  'bus'
2826;select student_capacity from dorm where dorm_name  =  'smith hall'
2827;select count ( * )  from dorm where gender  =  'f'
2828;select amenity_name from dorm_amenity
2829;select t1.amenity_name from dorm_amenity as t1 join has_amenity as t2 on t2.amenid   =   t1.amenid join dorm as t3 on t2.dormid   =   t3.dormid where t3.dorm_name   =   'anonymous donor hall' order by t1.amenity_name
2830;select fname ,  lname from student
2831;select age from student
2832;select fname ,  lname from student where age  <   ( select avg ( age )  from student )
2833;select count ( * )  from projects
2834;select count ( project_id )  from projects where project_id not in  (  select project_id from project_staff where role_code  =  'researcher'  )
2835;select project_details from projects where project_id not in  (  select project_id from project_staff where role_code  =  'researcher'  )
2836;select avg ( followers )  from user_profiles
2837;select t1.name  from accounts as t1 join checking as t2 on t1.custid   =   t2.custid join savings as t3 on t1.custid   =   t3.custid where t3.balance  <  t2.balance
2838;select  t3.balance + t2.balance from accounts as t1 join checking as t2 on t1.custid   =   t2.custid join savings as t3 on t1.custid   =   t3.custid where t1.name  =  'weeks'
2839;select  custid  from accounts where name  =  'weeks'
2840;select name from scientists
2841;select count ( * )  from class as t1 join enroll as t2 on t1.class_code   =   t2.class_code join course as t3 on t1.crs_code   =   t3.crs_code join department as t4 on t3.dept_code   =   t4.dept_code where t4.dept_name   =   'accounting'
2842;select t2.stu_num from class as t1 join enroll as t2 on t1.class_code   =   t2.class_code join course as t3 on t1.crs_code   =   t3.crs_code join department as t4 on t3.dept_code   =   t4.dept_code where t4.dept_name   =   'accounting'
2843;select t3.crs_code from class as t1 join enroll as t2 on t1.class_code   =   t2.class_code join course as t3 on t1.crs_code   =   t3.crs_code join department as t4 on t3.dept_code   =   t4.dept_code where t4.dept_name   =   'accounting'
2844;select class_time from class where crs_code = 'acct-211'
2845;select * from employees order by salary desc limit 1
2846;select * from employees order by salary limit 1
2847;select issue_date from volume where song like '%the way%'
2848;select volume_issue from volume where song like '%the way%'
2849;select artist_id from volume where song like '%everybody have fun tonight%'
2850;select issue_date from volume order by weeks_on_top asc limit 1
2851;select count ( country )  from artist
2852;select artist_name from song group by artist_name order by count ( * )  limit 1
2853;select country from artist where artist_name  =  'enrique'
2854;select name from browser
2855;select t1.name from browser as t1 join accelerator_compatible_browser as t2 on t1.id  =  t2.browser_id join web_client_accelerator as t3 on t2.accelerator_id  =  t3.id where t3.name  =  'cproxy' and t2.compatible_since_year > 1998
2856;select t1.id from browser as t1 join accelerator_compatible_browser as t2 on t1.id  =  t2.browser_id join web_client_accelerator as t3 on t2.accelerator_id  =  t3.id where t1.name  =  'opera'
2857;select campus from campuses where campus like '%california state university%' and county  =  'kern'
2858;select year from campuses where campus  =  'california state university-chico'
2859;select campus from campuses where year  =  2002
2860;select t1.driverid , t1.surname from drivers as t1 join results as t2 on t1.driverid  =  t2.driverid join races as t3 on t2.raceid  =  t3.raceid where t3.year > 2010 group by t1.driverid order by count ( * )  desc limit 1
2861;select t1.driverid from drivers as t1 join results as t2 on t1.driverid  =  t2.driverid join races as t3 on t2.raceid  =  t3.raceid where t3.year > 2010 group by t1.driverid order by count ( * )  limit 1
2862;select t1.surname from drivers as t1 join results as t2 on t1.driverid  =  t2.driverid join races as t3 on t2.raceid  =  t3.raceid where t3.year > 2010 group by t1.driverid order by count ( * )  limit 1
2863;select count ( * )  from drivers as t1 join results as t2 on t1.driverid  =  t2.driverid join races as t3 on t2.raceid  =  t3.raceid where t3.year > 2010 group by t1.driverid order by count ( * )  limit 1
2864;select count ( * )  from drivers as t1 join results as t2 on t1.driverid  =  t2.driverid join races as t3 on t2.raceid  =  t3.raceid where t3.year > 2010 and t1.surname = 'hamilton' group by t1.driverid
2865;select * from wedding where year > 2014
2866;select t2.name from wedding as t1 join people as t2 on t1.male_id   =   t2.people_id where t1.year  >  2014
2867;select t3.name from wedding as t1 join people as t2 on t1.male_id   =   t2.people_id join people as t3 on t1.female_id   =   t3.people_id where t1.year  >  2014
2868;select company from entrepreneur
2869;select * from entrepreneur
2870;select t1.company from entrepreneur as t1 join people as t2 on t1.people_id   =   t2.people_id order by t2.height desc limit 1
2871;select count ( * )  from participants
2872;select count ( distinct event_id )  from participants_in_events
2873;select t2.event_id from participants as t1 join participants_in_events as t2 on t1.participant_id   =   t2.participant_id where t1.participant_details like '%dr.%'
2874;select t2.event_id, t1.participant_details  from participants as t1 join participants_in_events as t2 on t1.participant_id   =   t2.participant_id
2875;select stuid from sportsinfo intersect select stuid from plays_games
2876;select onscholarship from sportsinfo where stuid  =  1001
2877;select artist_name from artist
2878;select artist_name from artist where country  =  'uk' intersect select t1.artist_name from artist as t1 join song as t2 on t1.artist_name  =  t2.artist_name
2879;select * from song where artist_name = 'michel' and languages  =  'english'
2880;select count ( * )  from trip where start_date like '8/%'
2881;select count ( distinct start_station_name )  from trip where start_date like '8/%'
2882;select start_station_name from trip where start_date like '8/%' group by start_station_name order by count ( * )  desc limit 1
2883;select count ( * )  from trip where start_station_name  =   ( select start_station_name from trip where start_date like '8/%' group by start_station_name order by count ( * )  desc limit 1 )
2884;select distinct start_station_name ,  start_station_id from trip where start_station_name  =  'san francisco caltrain 2  ( 330 townsend ) '
2885;select distinct product_name from products
2886;select country from airlines
2887;select * from genres as t1 join tracks as t2 on t1.id  =  t2.genre_id where t1.name  =  'rock'
2888;select t2.name from genres as t1 join tracks as t2 on t1.id  =  t2.genre_id join media_types as t3 on t3.id  =  t2.media_type_id where t1.name  =  'rock' or t3.name  =  'mpeg audio file'
2889;select t2.name from genres as t1 join tracks as t2 on t1.id  =  t2.genre_id join media_types as t3 on t3.id  =  t2.media_type_id where t1.name  =  'rock' or t3.name  =  'mpeg audio file'
2890;select count ( distinct t2.media_type_id )  from genres as t1 join tracks as t2 on t1.id  =  t2.genre_id join media_types as t3 on t3.id  =  t2.media_type_id where t1.name  =  'rock'
2891;select count ( * )  from management where temporary_acting   =   'no'
2892;select t1.vehicle_id ,  t2.staff_id from vehicles as t1 join lessons as t2 on t1.vehicle_id   =   t2.vehicle_id
2893;select vehicle_details from vehicles where vehicle_id   =  '1' or vehicle_id   =  '2'
2894;select price from lessons where  vehicle_id   =  '2'
2895;select t1.vehicle_id ,  t1.vehicle_details from vehicles as t1 join lessons as t2 on t1.vehicle_id   =   t2.vehicle_id group by t1.vehicle_id order by count ( * )  desc limit 1
2896;select country from inst where name = 'tohoku university'
2897;select instid from inst where name = 'tohoku university'
2898;select dept_name from  department
2899;select * from course where crs_description like '%statistics%'
2900;select t2.dept_name from course as t1 join department as t2 on t1.dept_code   =   t2.dept_code where t1.crs_description like '%statistics%'
2901;select t1.crs_code from course as t1 join department as t2 on t1.dept_code   =   t2.dept_code where t2.dept_name  =  'computer info. systems'
2902;select crs_credit from course where crs_code in  ( select t1.crs_code from course as t1 join department as t2 on t1.dept_code   =   t2.dept_code where t2.dept_name  =  'computer info. systems' )
2903;select t1.service_type_code from services as t1 join events as t2 on t1.service_id  =  t2.service_id where t2.event_details  =  'success'
2904;select t1.service_type_code from services as t1 join events as t2 on t1.service_id  =  t2.service_id where t2.event_details  =  'fail'
2905;select t1.service_type_code from services as t1 join events as t2 on t1.service_id  =  t2.service_id where t2.event_details  =  'success' intersect select t1.service_type_code from services as t1 join events as t2 on t1.service_id  =  t2.service_id where t2.event_details  =  'fail'
2906;select student_id from students where first_name   =   'emma'
2907;select last_name from students where first_name   =   'emma'
2908;select email_address from students where first_name   =   'emma'
2909;select t1.engineer_id ,  t1.first_name ,  t1.last_name from maintenance_engineers as t1 join engineer_visits as t2 on t1.engineer_id  =  t2.engineer_id group by t1.engineer_id order by count ( * )  desc limit 1
2910;select t2.fault_status from maintenance_engineers as t1 join engineer_visits as t2 on t1.engineer_id  =  t2.engineer_id where t1.first_name  =  'etha'
2911;select t2.visit_start_datetime from maintenance_engineers as t1 join engineer_visits as t2 on t1.engineer_id  =  t2.engineer_id where t1.first_name  =  'etha'
2912;select t2.visit_end_datetime from maintenance_engineers as t1 join engineer_visits as t2 on t1.engineer_id  =  t2.engineer_id where t1.first_name  =  'etha'
2913;select name from user_profiles
2914;select name from user_profiles order by followers desc limit 1
2915;select email from user_profiles order by followers desc limit 1
2916;select t2.f1 from user_profiles as t1 join follows as t2 on t1.uid   =   t2.f2 where t1.name   =   'mary' intersect select t2.f1 from user_profiles as t1 join follows as t2 on t1.uid   =   t2.f2 where t1.name   =   'susan'
2917;select ppos from tryout group by ppos order by count ( * )  desc limit 1
2918;select cname from tryout where ppos  =   ( select ppos from tryout group by ppos order by count ( * )  desc limit 1 )
2919;select decision from tryout where ppos  =   ( select ppos from tryout group by ppos order by count ( * )  desc limit 1 )
2920;select t1.name from inst as t1 join authorship as t2 on t1.instid  =  t2.instid join papers as t3 on t2.paperid  =  t3.paperid group by t1.name order by count ( * )  desc limit 1
2921;select country from inst where name = 'university of oxford'
2922;select instid from inst where name = 'university of oxford'
2923;select title from papers where paperid = '200'
2924;select count ( * )  from gymnast
2925;select hire_date from employees order by commission_pct asc limit 1
2926;select count ( * )  from students
2927;select incident_type_code from behavior_incident where student_id  =  1
2928;select recommendations from behavior_incident
2929;select cell_mobile_number from students where student_id  =  1
2930;select director from movie where title  =  'star wars'
2931;select rank from faculty where fname  =  'mark'
2932;select count ( * )  from faculty
2933;select distinct rank from faculty
2934;select count ( * )  from student
2935;select avg ( stu_gpa )  from student
2936;select enroll_grade from enroll order by enroll_grade asc limit 1
2937;select country from addresses where city  =  'ericamouth'
2938;select name from county_public_safety where county_id not in  ( select county_id from city )
2939;select distinct t1.title from papers as t1 join authorship as t2 on t1.paperid   =   t2.paperid join inst as t3 on t2.instid   =   t3.instid where t3.name   =   'indiana university'
2940;select paperid from papers where title  =   ( select distinct t1.title from papers as t1 join authorship as t2 on t1.paperid   =   t2.paperid join inst as t3 on t2.instid   =   t3.instid where t3.name   =   'indiana university' )
2941;select count ( * )  from authorship
2942;select capital from country where country_name  =  'indonesia'
2943;select capital from country where country_name  =  'iran'
2944;select count ( distinct t1.official_native_language )  from country as t1 join match_season as t2 on t1.country_id   =   t2.country where t2.position   =   'defender'
2945;select name from ship
2946;select count ( * )  from sportsinfo as t1 join student as t2 on t1.stuid   =   t2.stuid where t1.onscholarship   =   'y'
2947;select t2.lname from sportsinfo as t1 join student as t2 on t1.stuid   =   t2.stuid where t1.onscholarship   =   'y'
2948;select t2.fname from sportsinfo as t1 join student as t2 on t1.stuid   =   t2.stuid where t1.onscholarship   =   'y'
2949;select t2.major from sportsinfo as t1 join student as t2 on t1.stuid   =   t2.stuid where t1.onscholarship   =   'y'
2950;select t1.sportname from sportsinfo as t1 join student as t2 on t1.stuid   =   t2.stuid where t1.onscholarship   =   'y'
2951;select open_date from church group by open_date having count ( * )    >=    2
2952;select name from church order by open_date desc limit 1
2953;select open_date from church order by open_date desc limit 1
2954;select employer_organisation_id , count ( * )  from research_staff group by employer_organisation_id
2955;select staff_id from research_staff where employer_organisation_id  =  5
2956;select t1.name from inst as t1 join authorship as t2 on t1.instid   =   t2.instid join papers as t3 on t2.paperid   =   t3.paperid group by t1.name order by count ( * )  desc limit 1
2957;select t1.name from inst as t1 join authorship as t2 on t1.instid   =   t2.instid join papers as t3 on t2.paperid   =   t3.paperid group by t1.name order by count ( * )  asc limit 1
2958;select t3.title from inst as t1 join authorship as t2 on t1.instid   =   t2.instid join papers as t3 on t2.paperid   =   t3.paperid where t1.name  =  'google'
2959;select distinct t2.name from undergoes as t1 join patient as t2 on t1.patient  =  t2.ssn join stay as t3 on t1.stay   =   t3.stayid where t3.room   =   111
2960;select name from patient where insuranceid  =  68476213
2961;select distinct physician from undergoes where patient  =  100000001
2962;select address_id from addresses where city   =  'damianfort'
2963;select t1.document_id from documents_with_expenses as t1 join ref_budget_codes as t2 on t1.budget_type_code   =   t2.budget_type_code where t2.budget_type_description   =   'government'
2964;select t1.document_details from documents_with_expenses as t1 join ref_budget_codes as t2 on t1.budget_type_code   =   t2.budget_type_code where t2.budget_type_description   =   'government'
2965;select t1.document_id from documents_with_expenses as t1 join ref_budget_codes as t2 on t1.budget_type_code   =   t2.budget_type_code where t2.budget_type_description   =   'organisation'
2966;select t2.budget_type_code from documents_with_expenses as t1 join ref_budget_codes as t2 on t1.budget_type_code   =   t2.budget_type_code where t2.budget_type_description   =   'organisation'
2967;select document_details from documents_with_expenses order by document_id desc limit 1
2968;select count ( * )  from shop where score > 37
2969;select shop_id from shop order by num_of_staff asc limit 1
2970;select count ( * )  from party
2971;select party from party
2972;select party from party group by party having count ( * )  > 1
2973;select attorney_general from party where party = 'democratic'
2974;select asset_acquired_date from assets
2975;select asset_acquired_date from assets order by asset_acquired_date asc limit 1
2976;select count ( * )  from wrestler
2977;select distinct location from wrestler
2978;select wrestler_id from wrestler
2979;select reign from wrestler group by reign order by count ( * )  desc limit 1
2980;select employee_id from employees except select destroyed_by_employee_id from documents_to_be_destroyed
2981;select employee_name from employees where employee_id in  ( select employee_id from employees except select destroyed_by_employee_id from documents_to_be_destroyed )
2982;select role_code from employees where employee_id in  ( select employee_id from employees except select destroyed_by_employee_id from documents_to_be_destroyed )
2983;select count ( * )  from  class
2984;select count ( distinct  emp_num )  from employee where emp_jobcode = 'prof'
2985;select count ( * )  from employee as t1 join class as t2 on t1.emp_num   =   t2.prof_num where t1.emp_lname   =   'graztevski'
2986;select t1.appelation from appellations as t1 join wine as t2 on t1.appelation   =   t2.appelation where t2.price  =   ( select max ( price )  from wine )
2987;select max ( t2.price )  from appellations as t1 join wine as t2 on t1.appelation   =   t2.appelation where t1.county   =   'sonoma'
2988;select count ( * )  from appellations as t1 join wine as t2 on t1.appelation   =   t2.appelation where t1.county   =   'sonoma'
2989;select min ( t2.price )  from appellations as t1 join wine as t2 on t1.appelation   =   t2.appelation where t1.county   =   'sonoma'
2990;select avg ( t2.price )  from appellations as t1 join wine as t2 on t1.appelation   =   t2.appelation where t1.county   =   'sonoma'
2991;select t2.location from race as t1 join track as t2 on t1.track_id   =   t2.track_id where t2.name  =  'auto club speedway'
2992;select t2.location from race as t1 join track as t2 on t1.track_id   =   t2.track_id where t2.name  =  'chicagoland speedway'
2993;select t2.seating from race as t1 join track as t2 on t1.track_id   =   t2.track_id where t2.name  =  'chicagoland speedway'
2994;select name from journalist
2995;select t1.event_id,t1.date  from event as t1 join news_report as t2 on t1.event_id = t2.event_id
2996;select count ( * )  ,  t3.dorm_name from student as t1 join lives_in as t2 on t1.stuid   =   t2.stuid join dorm as t3 on t3.dormid   =   t2.dormid group by t3.dorm_name
2997;select avg ( t1.age )  ,  t3.dorm_name from student as t1 join lives_in as t2 on t1.stuid   =   t2.stuid join dorm as t3 on t3.dormid   =   t2.dormid group by t3.dorm_name
2998;select min ( t1.age ) , max ( t1.age ) ,  t3.dorm_name from student as t1 join lives_in as t2 on t1.stuid   =   t2.stuid join dorm as t3 on t3.dormid   =   t2.dormid group by t3.dorm_name
2999;select count ( * )  from student where age  =  26
3000;select name from swimmer where nationality   =   'australia'
3001;select name from manufacturers
3002;select distinct cname from tryout
3003;select count ( * )  from projects
3004;select t3.balance from accounts as t1 join checking as t2 on t1.custid  =  t2.custid join savings as t3 on t1.custid  =  t3.custid order by t2.balance desc limit 1
3005;select t3.balance from accounts as t1 join checking as t2 on t1.custid  =  t2.custid join savings as t3 on t1.custid  =  t3.custid order by t2.balance  limit 1
3006;select balance from checking where custid = '3'
3007;select count ( product_id )  from products_for_hire where product_type_code   =   'cutlery'
3008;select count ( product_id )  from products_for_hire where daily_hire_cost < 20
3009;select count ( product_id )  from products_for_hire where product_type_code   =   'cutlery' and daily_hire_cost  <  20
3010;select distinct ( name )  from tourist_attractions
3011;select name from people where people_id not in  ( select affirmative from debate_people )
3012;select city from airports where country   =   'united states' group by city having count ( * )   >  3
3013;select city from airports where country   =   'united states' group by city having count ( * )   >  4
3014;select title from movie
3015;select title from movie where  year   <  1980
3016;select title from movie where director   =   'james cameron'
3017;select title from movie where director   =   'james cameron' or year   <  1980
3018;select roller_coaster_id from roller_coaster where length  >  3300
3019;select roller_coaster_id from roller_coaster where length  >  3300 and height > 100
3020;select roller_coaster_id , status from roller_coaster where length  >  3300 and height > 100
3021;select roller_coaster_id , status, speed from roller_coaster where length  >  3300 and height > 100
3022;select shipping_agent_code from ref_shipping_agents
3023;select shipping_agent_code, count ( * )  from documents group by shipping_agent_code
3024;select count ( employee_id )  from employees
3025;select count ( destruction_authorised_by_employee_id )  from documents_to_be_destroyed
3026;select destruction_authorised_by_employee_id from documents_to_be_destroyed
3027;select sum ( employee_id )  from employees except select destruction_authorised_by_employee_id from documents_to_be_destroyed
3028;select employee_id from employees except select destruction_authorised_by_employee_id from documents_to_be_destroyed
3029;select sum ( gamesplayed )  from sportsinfo
3030;select sum ( gamesplayed )  from sportsinfo where onscholarship   =   'y'
3031;select distinct sportname from sportsinfo
3032;select aircraft from aircraft
3033;select t1.aircraft from aircraft as t1 join match as t2 on t1.aircraft_id   =   t2.winning_aircraft
3034;select stuid from has_allergy where allergy   =   'milk' intersect select stuid from has_allergy where allergy   =   'cat'
3035;select lname from student where stuid in  ( select stuid from has_allergy where allergy   =   'milk' intersect select stuid from has_allergy where allergy   =   'cat' )
3036;select lname ,  age from student where stuid in  ( select stuid from has_allergy where allergy   =   'milk' intersect select stuid from has_allergy where allergy   =   'cat' )
3037;select count ( artwork_id )  from nomination
